{
  "manifestVersion": 1,
  "id": "atlas-trend-kr",
  "publisher": "aumos",
  "name": "Atlas Trend KR",
  "version": "0.2.3",
  "description": "Time-series momentum across a fixed basket of Korea-listed ETFs, in won. Holds only what is trending in its own price, sizes what it holds by realised volatility, and parks in CD-rate funds when nothing is. One monthly rebalance, or nothing.",
  "readme": "./README.md",
  "prompt": "./PROMPT.md",
  "runtimes": [
    "claude"
  ],
  "license": "MIT",
  "engines": {
    "aumos": ">=0.3.18"
  },
  "ampVersion": 1,
  "schedule": [
    {
      "cron": "0 8 LW * *",
      "timeZone": "UTC"
    }
  ],
  "contributes": {
    "managers": [
      {
        "id": "atlas-trend-kr",
        "name": "Atlas Trend KR",
        "description": "Scores five roles of Korea-listed ETF on an ensemble of 1, 3, 6 and 12-month won-denominated returns, holds only the positive ones at inverse-volatility weights under a portfolio volatility target, and puts everything else in a CD-rate fund. Hedged and unhedged share classes compete for the same role and are never held together. Returns one REBALANCE carrying the whole basket, or WAIT.",
        "tasks": [
          "PORTFOLIO_REVIEW"
        ],
        "assetClasses": [
          "etf",
          "cash"
        ],
        "markets": [
          "XKRX"
        ]
      }
    ]
  },
  "capabilities": [
    {
      "kind": "source:passthrough",
      "reason": "금융위원회's 증권상품시세정보 supplies the NAV, the underlying index and the fund size that say whether the fund is worth holding at all. The answer is the vendor's, unread by Aumos.",
      "sources": [
        "fsc-securities-product"
      ]
    },
    {
      "kind": "portfolio:read",
      "reason": "The proposal is a set of weights for the whole book, so the book as it stands is the only thing that says whether those weights are already held. Without it every run would propose a trade."
    },
    {
      "kind": "brief:read",
      "reason": "Whether this book is currently in the all-cash state, and since when. A trend system's behaviour depends on where it already is, and that is a fact about the book rather than about any one asset."
    },
    {
      "kind": "brief:write",
      "reason": "To record entering or leaving that state, once, when it changes — so the next run and the other managers on this book can read it instead of inferring it from weights."
    },
    {
      "kind": "connection:passthrough",
      "reason": "토스증권 supplies the adjusted won price history the trend is measured on. Its answer is relayed through the investor's existing Toss connection and remains unread by Aumos.",
      "connectors": [
        "toss"
      ]
    }
  ],
  "requires": {
    "skills": [
      "source_request",
      "connection_request"
    ],
    "optionalSkills": [
      "portfolio_read",
      "brief_read",
      "brief_write"
    ]
  },
  "network": {
    "mode": "deny"
  },
  "config": {
    "schema": "config.schema.json"
  },
  "memory": {
    "persistent": false
  },
  "character": {
    "generator": "aumos-pixel-v1",
    "seed": "atlas-trend-kr"
  }
}
