{
  "manifestVersion": 1,
  "id": "earnings-drift-watcher",
  "publisher": "aumos",
  "name": "Earnings Drift Watcher",
  "version": "0.2.3",
  "description": "Judges one thing only: whether the market has finished reacting to a reported surprise. Compares the reported figure against what was expected, then against how far the price has already travelled, and mostly concludes that it is too late.",
  "readme": "./README.md",
  "prompt": "./PROMPT.md",
  "runtimes": [
    "claude"
  ],
  "license": "MIT",
  "engines": {
    "aumos": ">=0.2.4"
  },
  "ampVersion": 1,
  "contributes": {
    "managers": [
      {
        "id": "earnings-drift-watcher",
        "name": "Earnings Drift Watcher",
        "description": "Post-announcement drift, as a single question. Reads the reported figure against expectation, measures how much of the resulting move has already happened, and returns WATCH far more often than it returns anything else — because the answer to 'has the market finished reacting' is usually 'ask again later'.",
        "tasks": [
          "EVENT_REVIEW",
          "ASSET_REVIEW"
        ],
        "assetClasses": [
          "equity"
        ],
        "markets": [
          "XNAS",
          "XNYS"
        ]
      }
    ]
  },
  "capabilities": [
    {
      "kind": "source:passthrough",
      "reason": "The reported figure, the expectation it is measured against, and the price history around the announcement — asked of the data sources this machine holds credentials for. The responses are the vendors’, unread by Aumos. A surprise nobody has priced and a surprise fully priced are the same fundamental fact and opposite judgements, so both halves are one ask."
    },
    {
      "kind": "portfolio:read",
      "reason": "Whether the book already holds it. Drift on a position you own is a question about sizing; drift on one you do not is a question about entering, and they are not the same judgement."
    }
  ],
  "requires": {
    "skills": [
      "source_request"
    ],
    "optionalSkills": [
      "portfolio_read"
    ]
  },
  "network": {
    "mode": "deny"
  },
  "memory": {
    "persistent": false
  },
  "character": {
    "generator": "aumos-pixel-v1",
    "seed": "earnings-drift-watcher"
  }
}
