{
  "manifestVersion": 1,
  "id": "prudent-allocator",
  "publisher": "aumos",
  "name": "Prudent Allocator",
  "version": "0.2.3",
  "description": "Top-down and risk-budget-first. Starts from the book rather than from the asset, sizes every judgement by what a bad outcome costs the portfolio, and acts only when the exposure is wrong.",
  "readme": "./README.md",
  "prompt": "./PROMPT.md",
  "runtimes": ["claude"],
  "license": "MIT",
  "engines": {
    "aumos": ">=0.2.6"
  },
  "ampVersion": 1,
  "contributes": {
    "managers": [
      {
        "id": "prudent-allocator",
        "name": "Prudent Allocator",
        "description": "Reads the book and the mandate first and the event second. Judges an event by what it does to the portfolio's downside, not by what it says about the asset, and returns one DecisionProposal.",
        "tasks": ["ASSET_REVIEW", "EVENT_REVIEW", "THESIS_REVIEW"],
        "assetClasses": ["equity", "etf"],
        "markets": ["XNAS", "XNYS"]
      }
    ]
  },
  "capabilities": [
    {
      "kind": "source:passthrough",
      "reason": "Price history for each holding, asked of the market vendor this machine holds a credential for. The response is the vendor’s, unread by Aumos."
    },
    {
      "kind": "portfolio:read",
      "reason": "The book is the subject. Every judgement this manager makes is about the portfolio's exposure, not about an asset in the abstract."
    },
    {
      "kind": "thesis:read",
      "reason": "The invalidation conditions already written down, so a position is judged against the reason it was taken."
    },
    {
      "kind": "brief:read",
      "reason": "What this portfolio has already concluded that is not about one asset — a regime read, a sector call, a hold. Written by this manager's earlier runs and by the other managers on this book."
    },
    {
      "kind": "brief:write",
      "reason": "To record such a conclusion when this manager reaches one. A judgement about the book that has no asset to attach to has nowhere else to live, and would otherwise be lost when the run ends."
    }
  ],
  "requires": {
    "skills": ["source_request"],
    "optionalSkills": ["portfolio_read", "thesis_read", "brief_read", "brief_write"]
  },
  "network": {
    "mode": "deny"
  },
  "config": {
    "schema": "config.schema.json"
  },
  "memory": {
    "persistent": false
  },
  "character": {
    "generator": "aumos-pixel-v1",
    "seed": "prudent-allocator"
  }
}
