{
  "manifestVersion": 1,
  "id": "evidence-gated",
  "publisher": "aumos",
  "name": "Evidence-Gated Allocator",
  "version": "0.4.42",
  "description": "One evidence-gated methodology run as three market flows: a Korean sleeve, a US sleeve, and the allocator that sets their budgets and proposes the cross-market rebalance. The flows are subagents of one manager; only the orchestrator submits.",
  "readme": "./README.md",
  "prompt": "./PROMPT.md",
  "schedule": [
    {
      "cron": "0 16 * * 1-5",
      "timeZone": "Asia/Seoul",
      "label": "kr-sleeve"
    },
    {
      "cron": "45 16 * * 1-5",
      "timeZone": "America/New_York",
      "label": "us-sleeve"
    },
    {
      "cron": "0 8 * * 1-5",
      "timeZone": "Asia/Seoul",
      "label": "allocate"
    }
  ],
  "runtimes": [
    "claude"
  ],
  "license": "MIT",
  "provenance": {
    "sourceRepo": "https://github.com/morethanmin/trading-harness",
    "commit": "7702b19a04678b833c90ba1f6323e74232795155",
    "license": "MIT",
    "licenseHolder": "Lee Sang Min",
    "notice": "./NOTICE.md"
  },
  "engines": {
    "aumos": ">=0.3.32"
  },
  "ampVersion": 1,
  "contributes": {
    "managers": [
      {
        "id": "evidence-gated",
        "name": "Evidence-Gated Allocator",
        "description": "One evidence-gated methodology run as three market flows: a Korean sleeve, a US sleeve, and the allocator that sets their budgets and proposes the cross-market rebalance. The flows are subagents of one manager; only the orchestrator submits.",
        "tasks": [
          "PORTFOLIO_REVIEW",
          "ASSET_REVIEW",
          "THESIS_REVIEW",
          "EVENT_REVIEW"
        ],
        "assetClasses": [
          "equity",
          "etf",
          "cash"
        ],
        "markets": [
          "XKRX",
          "XNAS",
          "XNYS"
        ]
      }
    ]
  },
  "capabilities": [
    {
      "kind": "portfolio:read",
      "reason": "Current holdings, weights and cash are the denominator for every sizing and concentration judgement."
    },
    {
      "kind": "thesis:read",
      "reason": "Existing claims and falsifiable invalidation conditions are checked before any holding or candidate is changed."
    },
    {
      "kind": "evidence:read",
      "reason": "Prior source observations are inspected by id so research can be verified without copying raw evidence into private memory."
    },
    {
      "kind": "brief:read",
      "reason": "Book-wide regime, sector and entry-hold conclusions are read separately from asset theses."
    },
    {
      "kind": "brief:write",
      "reason": "A changed portfolio-wide conclusion is recorded as a revision rather than hidden in private memory."
    },
    {
      "kind": "manager-memory:read",
      "reason": "This instance reads lens sample counts, calibration and repeated failure patterns from earlier runs."
    },
    {
      "kind": "manager-memory:write",
      "reason": "Meaningful new closed outcomes and coverage changes create append-only revisions to stable learning keys."
    },
    {
      "kind": "source:passthrough",
      "sources": [
        "sec-edgar",
        "open-dart"
      ],
      "reason": "SEC filings and OpenDART receipts and statements are checked as independent vendor evidence; configured OpenBB/FMP history may supplement bars."
    },
    {
      "kind": "source-cache:read",
      "reason": "The fundamental discovery branch reads stored OpenDART and SEC filings instead of re-procuring every run, and the answer's state separates a cache nobody has ever filled from a refresh that failed — the distinction the starvation diagnosis is built on."
    },
    {
      "kind": "source-cache:write",
      "reason": "A stale or never-fetched filing is refreshed for the named filer only, so the branch is fed on the run that needs it rather than reporting starvation it could have resolved."
    },
    {
      "kind": "observation:file",
      "reason": "Broker consensus estimates and price targets exist on the web and in no filing and on no exchange feed, and `variantViewCheck` will not open the 20% single-name lane without a dated consensus citation. `observation_file` is the only route by which a reading reaches `evidenceIds` at all: the source's own words, its URL and its publication date are filed and hashed, so what the lane rests on is something an auditor can go and check. The row is filed as this manager's testimony rather than as an Aumos observation, and every proposal it sizes says so where the investor reads before approving."
    },
    {
      "kind": "connection:passthrough",
      "connectors": [
        "toss",
        "alpaca"
      ],
      "reason": "Toss market data plus Alpaca news and corporate actions are checked as independent vendor evidence through the investor's existing broker connections; Aumos relays each vendor's answer unchanged and exposes no credential."
    }
  ],
  "requires": {
    "skills": [
      "source_request",
      "connection_request"
    ],
    "optionalSkills": [
      "source_cache_read",
      "source_cache_refresh",
      "observation_file",
      "portfolio_read",
      "thesis_read",
      "evidence_read",
      "brief_read",
      "brief_write",
      "memory_read",
      "memory_write"
    ]
  },
  "network": {
    "mode": "deny"
  },
  "config": {
    "schema": "config.schema.json"
  },
  "memory": {
    "persistent": true
  }
}
